{
  "hesperus": "0.1",
  "generated": null,
  "root": "sys",
  "files": [
    {
      "path": "sys.hesp",
      "root": "sys"
    },
    {
      "path": "mesh.hesp",
      "root": "sys.mesh"
    },
    {
      "path": "web.hesp",
      "root": "sys.web"
    }
  ],
  "nodes": [
    {
      "id": "sys",
      "kind": "system",
      "name": "sys",
      "parent": null,
      "label": null,
      "desc": null,
      "src": [],
      "protocol": null,
      "host": null,
      "engine": null,
      "at": []
    },
    {
      "id": "sys.mesh",
      "kind": "subsystem",
      "name": "mesh",
      "parent": "sys",
      "label": null,
      "desc": null,
      "src": [
        "src/mesh/**"
      ],
      "protocol": null,
      "host": null,
      "engine": null,
      "at": []
    },
    {
      "id": "sys.mesh.peers",
      "kind": "component",
      "name": "peers",
      "parent": "sys.mesh",
      "label": null,
      "desc": null,
      "src": [
        "src/mesh/peers/**"
      ],
      "protocol": null,
      "host": null,
      "engine": null,
      "at": []
    },
    {
      "id": "sys.mesh.store",
      "kind": "component",
      "name": "store",
      "parent": "sys.mesh",
      "label": null,
      "desc": null,
      "src": [
        "src/mesh/store/**"
      ],
      "protocol": null,
      "host": null,
      "engine": null,
      "at": []
    },
    {
      "id": "sys.mesh.ledger",
      "kind": "store",
      "name": "ledger",
      "parent": "sys.mesh",
      "label": null,
      "desc": null,
      "src": [],
      "protocol": null,
      "host": null,
      "engine": "postgres",
      "at": []
    },
    {
      "id": "sys.mesh.tailscale",
      "kind": "external",
      "name": "tailscale",
      "parent": "sys.mesh",
      "label": null,
      "desc": null,
      "src": [],
      "protocol": "http",
      "host": "api.tailscale.com",
      "engine": null,
      "at": []
    },
    {
      "id": "sys.web",
      "kind": "subsystem",
      "name": "web",
      "parent": "sys",
      "label": null,
      "desc": null,
      "src": [
        "src/web/**"
      ],
      "protocol": null,
      "host": null,
      "engine": null,
      "at": []
    },
    {
      "id": "sys.web.short",
      "kind": "component",
      "name": "short",
      "parent": "sys.web",
      "label": null,
      "desc": null,
      "src": [
        "src/web/{a1,b2}.ts"
      ],
      "protocol": null,
      "host": null,
      "engine": null,
      "at": []
    },
    {
      "id": "sys.web.pair",
      "kind": "component",
      "name": "pair",
      "parent": "sys.web",
      "label": null,
      "desc": null,
      "src": [
        "src/web/??.ts"
      ],
      "protocol": null,
      "host": null,
      "engine": null,
      "at": []
    },
    {
      "id": "sys.web.ui",
      "kind": "component",
      "name": "ui",
      "parent": "sys.web",
      "label": null,
      "desc": null,
      "src": [
        "src/web/**/*.tsx"
      ],
      "protocol": null,
      "host": null,
      "engine": null,
      "at": []
    }
  ],
  "edges": [],
  "constraints": []
}
