{
  "hesperus": "0.1",
  "generated": "hesperus-ts",
  "root": "mesh",
  "files": [
    {
      "path": "actual.hesp",
      "root": "mesh"
    }
  ],
  "nodes": [
    {
      "id": "mesh",
      "kind": "system",
      "name": "mesh",
      "parent": null,
      "label": null,
      "desc": null,
      "src": [],
      "protocol": null,
      "host": null,
      "engine": null,
      "at": []
    },
    {
      "id": "mesh.peers",
      "kind": "subsystem",
      "name": "peers",
      "parent": "mesh",
      "label": null,
      "desc": null,
      "src": [],
      "protocol": null,
      "host": null,
      "engine": null,
      "at": []
    },
    {
      "id": "mesh.peers.accept",
      "kind": "component",
      "name": "accept",
      "parent": "mesh.peers",
      "label": null,
      "desc": null,
      "src": [],
      "protocol": null,
      "host": null,
      "engine": null,
      "at": []
    },
    {
      "id": "mesh.peers.dial",
      "kind": "component",
      "name": "dial",
      "parent": "mesh.peers",
      "label": null,
      "desc": null,
      "src": [],
      "protocol": null,
      "host": null,
      "engine": null,
      "at": []
    },
    {
      "id": "mesh.peers.gossip",
      "kind": "component",
      "name": "gossip",
      "parent": "mesh.peers",
      "label": null,
      "desc": null,
      "src": [],
      "protocol": null,
      "host": null,
      "engine": null,
      "at": []
    },
    {
      "id": "mesh.peers.link",
      "kind": "ingress",
      "name": "link",
      "parent": "mesh.peers",
      "label": null,
      "desc": null,
      "src": [],
      "protocol": "ws",
      "host": null,
      "engine": null,
      "at": []
    },
    {
      "id": "mesh.store",
      "kind": "subsystem",
      "name": "store",
      "parent": "mesh",
      "label": null,
      "desc": null,
      "src": [],
      "protocol": null,
      "host": null,
      "engine": null,
      "at": []
    },
    {
      "id": "mesh.store.log",
      "kind": "component",
      "name": "log",
      "parent": "mesh.store",
      "label": null,
      "desc": null,
      "src": [],
      "protocol": null,
      "host": null,
      "engine": null,
      "at": []
    },
    {
      "id": "mesh.web",
      "kind": "subsystem",
      "name": "web",
      "parent": "mesh",
      "label": null,
      "desc": null,
      "src": [],
      "protocol": null,
      "host": null,
      "engine": null,
      "at": []
    },
    {
      "id": "mesh.web.ui",
      "kind": "component",
      "name": "ui",
      "parent": "mesh.web",
      "label": null,
      "desc": null,
      "src": [],
      "protocol": null,
      "host": null,
      "engine": null,
      "at": []
    }
  ],
  "edges": [
    {
      "from": "mesh.peers.accept",
      "to": "mesh.store.log",
      "kind": "writes",
      "label": null,
      "desc": null,
      "resolved": true,
      "at": []
    },
    {
      "from": "mesh.peers.gossip",
      "to": "mesh.peers.accept",
      "kind": "calls",
      "label": null,
      "desc": null,
      "resolved": true,
      "at": []
    },
    {
      "from": "mesh.peers.gossip",
      "to": "mesh.store.log",
      "kind": "reads",
      "label": null,
      "desc": null,
      "resolved": true,
      "at": []
    },
    {
      "from": "mesh.peers.link",
      "to": "mesh.peers.accept",
      "kind": "ws",
      "label": null,
      "desc": null,
      "resolved": true,
      "at": []
    },
    {
      "from": "mesh.web.ui",
      "to": "mesh.peers.link",
      "kind": "ws",
      "label": null,
      "desc": null,
      "resolved": true,
      "at": []
    },
    {
      "from": "mesh.web.ui",
      "to": "mesh.store.log",
      "kind": "reads",
      "label": null,
      "desc": null,
      "resolved": true,
      "at": []
    }
  ],
  "constraints": []
}
