{
  "hesperus": "0.1",
  "generated": null,
  "root": "rt",
  "files": [
    {
      "path": "rt.hesp",
      "root": "rt"
    }
  ],
  "nodes": [
    {
      "id": "rt",
      "kind": "system",
      "name": "rt",
      "parent": null,
      "label": null,
      "desc": null,
      "src": [],
      "protocol": null,
      "host": null,
      "engine": null,
      "at": []
    },
    {
      "id": "rt.server",
      "kind": "component",
      "name": "server",
      "parent": "rt",
      "label": null,
      "desc": null,
      "src": [
        "src/server.ts",
        "src/sio.ts"
      ],
      "protocol": null,
      "host": null,
      "engine": null,
      "at": []
    },
    {
      "id": "rt.client",
      "kind": "component",
      "name": "client",
      "parent": "rt",
      "label": null,
      "desc": null,
      "src": [
        "src/client.ts"
      ],
      "protocol": null,
      "host": null,
      "engine": null,
      "at": []
    },
    {
      "id": "rt.feed",
      "kind": "external",
      "name": "feed",
      "parent": "rt",
      "label": null,
      "desc": null,
      "src": [],
      "protocol": "ws",
      "host": "stream.example.com",
      "engine": null,
      "at": []
    }
  ],
  "edges": [],
  "constraints": []
}
